input_text,reference_summary,bart_summary,pegasus_summary,led_summary
"[DOC_1]
Demonetisation has not affected mobile phone sales of Samsung India, which holds nearly half of India’s smartphone market and a sizeable portion of the feature phone market.

“Our Diwali and Puja sales were very good in October, after which it always cools down (in November). However, after the initial slowdown, it was back to normal in December,” Manu Sharma, Vice-President, Mobile Business, Samsung India, said in response to a question.

<doc-sep>

[DOC_2]
Tata Starbucks Pvt. Ltd, the joint venture of US beverage major Starbucks and Tata Global Beverages, has introduced Starbucks’ tea brand Teavana offering 18 distinct varieties of tea at its outlets to cater to tea lovers in India.

Since October 2012 Starbucks outlets are serving coffee only in India. Now tea will also be made available at all its 88 outlets in Mumbai, Delhi, NCR, Chennai, Bengaluru, Hyderabad and Pune, a top company official said.

<doc-sep>

[DOC_3]
Dormant airports such as Hosur, Bikaner, Bidar, Jalandhar, Jalgaon or Jaisalmer may soon start receiving flights as airlines have shown interest in flying out of these airports under the Centre’s ambitious regional connectivity scheme. Passengers may soon be able to fly out of these airports by paying ₹2,500 for an hour’s flight.

The Airports Authority of India, which is implementing the regional connectivity scheme, has received 45 proposals from 11 bidders covering more than 200 routes as the deadline for submitting the proposals ended on Monday, the civil aviation ministry said here in a statement.

<doc-sep>

[DOC_4]
Reserve Bank of India Governor Urjit Patel told the Parliamentary Standing Committee on Finance here on Wednesday that about ₹9.2 lakh crore had been put back in circulation since the demonetisation on November 8.

Prime Minister Narendra Modi’s announcement that ₹500 and ₹1,000 notes would cease to be legal tender from the midnight of November 8 had sucked out 86% — amounting to ₹15.44 lakh crore — of currency notes in circulation till then.

<doc-sep>

[DOC_5]
India would “very much” like U.S. based iPhone maker Apple to set up manufacturing base in the country, Minister for Communications and Information Technology Ravi Shankar Prasad said on Wednesday.

He added that the government would “surely” consider the company’s proposal with “open mind.”",After the Announcement of demonitization by pm modi over ₹15.44 lakh crore had came back and till now ₹9.2 lakh crore had been put back in circulation ,"Demonetisation has not affected mobile phone sales of Samsung India, which holds nearly half of India’s smartphone market and a sizeable portion of the feature phone market. The company has introduced 18 distinct varieties of tea at its outlets to cater to tea lovers in India.","The Reserve Bank of India Governor Urjit Patel told the Parliamentary Standing Committee on Finance here on Wednesday that about 9.2 lakh crore had been put back in circulation since the manufacturing on November 8. Prime Minister Narendra Modi’s announcement that 500 and 1,000 notes would cease to be legal tender from the midnight of November 8 had sucked out 86% of currency notes in circulation till then.","Demonetisation has not affected mobile phone sales of Samsung India, which holds nearly half of India’s smartphone market and a sizeable portion of the feature phone market. Samsung India’s Diwali and Puja sales were very good in October, after which it always cools down (in November). However, after the initial slowdown, it was back to normal in December,” Manu Sharma, Vice-President, Mobile Business, Samsung India, said in response to a question. He added that the company would “surely” consider the company’s proposal with “open mind."
"[DOC_1]
Israeli forces backed by fighter jets and drones carried out a second ground raid into Gaza in as many days and struck targets on the outskirts of Gaza City, the military said Friday, as it prepares for a widely expected ground invasion of the Hamas-ruled territory.

US warplanes meanwhile struck targets in eastern Syria that the Pentagon said were linked to Iran's Revolutionary Guard after a string of attacks on US forces by Iran-backed fighters, adding to the already high regional tensions fueled by the three-week-old Gaza war.

The Palestinian death toll has soared past 7,000 as Israel has carried out waves of devastating airstrikes in response to a bloody Hamas incursion into southern Israel on Oct 7. The Health Ministry in Gaza, which tracks the toll, released a detailed list of names and ID numbers on Thursday. The toll includes more than 2,900 minors and more than 1,500 women.

The overall number of deaths far exceeds the combined toll of all four previous wars between Israel and Hamas, estimated at around 4,000.

More than 1,400 people in Israel, mostly civilians, were slain during the initial Hamas attack, according to the Israeli government. Hamas is holding at least 229 captives inside Gaza, including men, women, children and older adults.

The airstrikes have flattened entire neighborhoods, causing a level of death and destruction unseen in the last four wars between Israel and Hamas. Over a million people have fled their homes, with many heeding Israeli orders to evacuate to the south, despite continuing Israeli strikes across the sealed-off territory.

The humanitarian crisis sparked by the war and the Israeli siege has sparked protests across the region, and more demonstrations were expected later Friday after weekly Muslim prayers.

The military said ground forces raided inside Gaza, striking dozens of militant targets over the past 24 hours. It said aircraft and artillery bombed targets in Shijaiyah, a neighborhood on the outskirts of Gaza City that was the scene of a bloody urban battle in the 2014 Gaza war.

The military said the soldiers exited the territory without suffering any casualties. It reported an earlier raid into northern Gaza early Thursday, saying ground forces battled militants and struck anti-tank missile firing positions in an operation that lasted hours.

Rear Adm. Daniel Hagari, an Israeli military spokesman, said the raids enable forces to “uncover the enemy,” to kill militants and to remove explosives and launch pads. The aim is “to prepare the ground for the next stages of the war,” he added.

The damage to Gaza from nearly three weeks of bombardment showed in satellite photos of several locations taken before the war and again in recent days.

Entire rows of residential buildings simply disappear in the photos, reduced to smears of dust and rubble. A complex of 13 high-rises by the sea was pounded to dust near Gaza City's al-Shati refugee camp, leaving only a few tottering bits of facade. Just down the street, hardly anything remained in what had been a neighborhood of low-built homes on winding lanes, according to the photos by Maxar Technologies.

The military says it only strikes militant targets and accuses Hamas of operating among civilians in an attempt to protect its fighters. The Israeli military said an airstrike killed one of two masterminds of the Oct. 7 massacre, Shadi Barud, the head of Hamas' intelligence unit.

Palestinian militants have fired thousands of rockets into Israel since the war began.

Hamas' military wing said Thursday that Israeli bombardment has so far killed about 50 of the hostages. There was no immediate comment from Israeli officials, who have denied previous, similar claims.

The conflict has threatened to ignite a wider war across the region.

Hezbollah, an Iranian-backed ally of Hamas in Lebanon, has repeatedly traded fire with Israel along the border, and Israel has carried out airstrikes targeting Iran-linked groups in Syria. The United States has sent two aircraft carrier strike groups to the region, along with additional fighter jets and other weaponry and personnel, in part to deter Iran and its allies from entering the war on the side of Hamas.

U.S. Defense Secretary Lloyd Austin said the strikes in eastern Syria were “a response to a series of ongoing and mostly unsuccessful attacks against U.S. Personnel in Iraq and Syria by Iranian-backed militia groups that began on Oct. 17.”

He said President Joe Biden directed the narrowly tailored strikes “to make clear that the United States will not tolerate such attacks and will defend itself, its personnel and its interests.” He added that the operation was separate and distinct from Israel's war against Hamas.

Syrian opposition activists in the area said the two locations are associated with Iranian arms shipments to militant groups in the region, and had been evacuated ahead of the strikes. There were no immediate reports of casualties.

Egyptian state media reported that six people were lightly wounded when a rocket slammed into a medical building in the town of Taba, on the border with Israel. It was not immediately known who fired the projectile.

Hagari, the Israeli military spokesperson, said “an aerial threat was identified in the area of the Red Sea,” which appeared to be the source of the blast in Egypt. He said fighter jets were dispatched to the area and that Israel, Egypt and the U.S. Were tightening their defenses in the region.

Last week, a U.S. Navy destroyer in the northern Red Sea shot down three cruise missiles and several drones launched toward Israel by Iran-backed Houthi rebels in northern Yemen.

In Gaza, supplies of food, medicine and fuel for powering emergency generators are running low. The U.N. Agency for Palestinian refugees, which provides basic services to hundreds of thousands of people, including operating schools turned into shelters, has said it may run out of fuel within days.

Gaza's sole power station shut down for lack of fuel days after the start of the war, and Israel has barred all fuel deliveries, saying it believes Hamas would steal them for military purposes.

About 1.4 million of Gaza's 2.3 million residents have fled their homes, with nearly half of them crowding into U.N. Shelters. Hundreds of thousands remain in northern Gaza, despite Israel ordering them to evacuate to the south and saying that those who remain might be considered “accomplices” of Hamas.

In recent days, Israel has let more than 70 trucks with aid enter from Egypt through the Rafah crossing, the only entry point into Gaza not controlled by Israel. But aid workers say the convoys meet only a tiny fraction of the territory's mounting humanitarian needs. Before the war, an average of 500 trucks entered Gaza each day.

The U.S. Has been working with other mediators to send in more humanitarian aid, but Israel is demanding strict screening to make sure none falls into the hands of Hamas. The U.S. Says Hamas has meanwhile refused to open the Gaza side of the Rafah crossing to let hundreds of foreign passport holders leave.

<doc-sep>

[DOC_2]
The United States on Friday expanded its effort to cut off funding for Hamas, announcing a second round of sanctions against people and organisations linked to the group since it launched an attack on Israel that killed more than 1,400 people.

The new sanctions highlight Iran's role in providing financial, logistical and operational support to Hamas, the US Treasury Department's Office of Foreign Assets Control said in a statement.

They include a Hamas representative in Iran and members of Iran's Islamic Revolutionary Guard.

The sanctions were announced as Deputy Treasury Secretary Wally Adeyemo travelled to London to shore up support from Britain, one of America's closest allies, for the drive to squeeze off funding for Hamas, which both countries consider a terrorist organisation.

“Today's action underscores the United States' commitment to dismantling Hamas's funding networks by deploying our counterterrorism sanctions authorities and working with our global partners to deny Hamas the ability to exploit the international financial system,” Adeyemo said.

Among those targeted are Khaled Qaddoumi, described as a liaison between Hamas and the Iranian government; and Ali Morshed Shirazi and Mostafa Mohammad Khani, officials in the Islamic Revolutionary Guard Corps' Qods Force who are accused of training and assisting Hamas fighters.

The US also sanctioned a number of organisations, including the Iranian Bonyad Shahid, also known as the Martyrs Foundation. US officials say the group, which is affiliated with Palestinian Islamic Jihad, funnels millions of dollars through the Gaza-based Al-Ansar Charity Association for the families of militants.

The practice “ultimately serves as a recruiting tool for terrorist activities”, the US said.

The sanctions freeze any US-based assets owned or controlled by the named individuals and organisations. They also block financial transactions with those designated and prohibit the contribution of funds, goods and services to them.

<doc-sep>

[DOC_3]
israeli forces backed by fighter jets and drones carried out a second ground raid into Gaza in as many days and struck targets on the outskirts of Gaza City, the military said Friday, as it prepares for a widely expected ground invasion of the Hamas-ruled territory.

US warplanes meanwhile struck targets in eastern Syria that the Pentagon said were linked to Iran's Revolutionary Guard after a string of attacks on US forces by Iran-backed fighters, adding to the already high regional tensions fueled by the three-week-old Gaza war.

The Palestinian death toll has soared past 7,000 as Israel has carried out waves of devastating airstrikes in response to a bloody Hamas incursion into southern Israel on Oct 7. The Health Ministry in Gaza, which tracks the toll, released a detailed list of names and ID numbers on Thursday. The toll includes more than 2,900 minors and more than 1,500 women.

The overall number of deaths far exceeds the combined toll of all four previous wars between Israel and Hamas, estimated at around 4,000.

More than 1,400 people in Israel, mostly civilians, were slain during the initial Hamas attack, according to the Israeli government. Hamas is holding at least 229 captives inside Gaza, including men, women, children and older adults.

The airstrikes have flattened entire neighborhoods, causing a level of death and destruction unseen in the last four wars between Israel and Hamas. Over a million people have fled their homes, with many heeding Israeli orders to evacuate to the south, despite continuing Israeli strikes across the sealed-off territory.

The humanitarian crisis sparked by the war and the Israeli siege has sparked protests across the region, and more demonstrations were expected later Friday after weekly Muslim prayers.

The military said ground forces raided inside Gaza, striking dozens of militant targets over the past 24 hours. It said aircraft and artillery bombed targets in Shijaiyah, a neighborhood on the outskirts of Gaza City that was the scene of a bloody urban battle in the 2014 Gaza war.

The military said the soldiers exited the territory without suffering any casualties. It reported an earlier raid into northern Gaza early Thursday, saying ground forces battled militants and struck anti-tank missile firing positions in an operation that lasted hours.

Rear Adm. Daniel Hagari, an Israeli military spokesman, said the raids enable forces to “uncover the enemy,” to kill militants and to remove explosives and launch pads. The aim is “to prepare the ground for the next stages of the war,” he added.

The damage to Gaza from nearly three weeks of bombardment showed in satellite photos of several locations taken before the war and again in recent days.

Entire rows of residential buildings simply disappear in the photos, reduced to smears of dust and rubble. A complex of 13 high-rises by the sea was pounded to dust near Gaza City's al-Shati refugee camp, leaving only a few tottering bits of facade. Just down the street, hardly anything remained in what had been a neighborhood of low-built homes on winding lanes, according to the photos by Maxar Technologies.

The military says it only strikes militant targets and accuses Hamas of operating among civilians in an attempt to protect its fighters. The Israeli military said an airstrike killed one of two masterminds of the Oct. 7 massacre, Shadi Barud, the head of Hamas' intelligence unit.

Palestinian militants have fired thousands of rockets into Israel since the war began.

Hamas' military wing said Thursday that Israeli bombardment has so far killed about 50 of the hostages. There was no immediate comment from Israeli officials, who have denied previous, similar claims.

The conflict has threatened to ignite a wider war across the region.

Hezbollah, an Iranian-backed ally of Hamas in Lebanon, has repeatedly traded fire with Israel along the border, and Israel has carried out airstrikes targeting Iran-linked groups in Syria. The United States has sent two aircraft carrier strike groups to the region, along with additional fighter jets and other weaponry and personnel, in part to deter Iran and its allies from entering the war on the side of Hamas.

U.S. Defense Secretary Lloyd Austin said the strikes in eastern Syria were “a response to a series of ongoing and mostly unsuccessful attacks against U.S. Personnel in Iraq and Syria by Iranian-backed militia groups that began on Oct. 17.”

He said President Joe Biden directed the narrowly tailored strikes “to make clear that the United States will not tolerate such attacks and will defend itself, its personnel and its interests.” He added that the operation was separate and distinct from Israel's war against Hamas.

Syrian opposition activists in the area said the two locations are associated with Iranian arms shipments to militant groups in the region, and had been evacuated ahead of the strikes. There were no immediate reports of casualties.

Egyptian state media reported that six people were lightly wounded when a rocket slammed into a medical building in the town of Taba, on the border with Israel. It was not immediately known who fired the projectile.

Hagari, the Israeli military spokesperson, said “an aerial threat was identified in the area of the Red Sea,” which appeared to be the source of the blast in Egypt. He said fighter jets were dispatched to the area and that Israel, Egypt and the U.S. Were tightening their defenses in the region.

Last week, a U.S. Navy destroyer in the northern Red Sea shot down three cruise missiles and several drones launched toward Israel by Iran-backed Houthi rebels in northern Yemen.

In Gaza, supplies of food, medicine and fuel for powering emergency generators are running low. The U.N. Agency for Palestinian refugees, which provides basic services to hundreds of thousands of people, including operating schools turned into shelters, has said it may run out of fuel within days.

Gaza's sole power station shut down for lack of fuel days after the start of the war, and Israel has barred all fuel deliveries, saying it believes Hamas would steal them for military purposes.

About 1.4 million of Gaza's 2.3 million residents have fled their homes, with nearly half of them crowding into U.N. Shelters. Hundreds of thousands remain in northern Gaza, despite Israel ordering them to evacuate to the south and saying that those who remain might be considered “accomplices” of Hamas.

In recent days, Israel has let more than 70 trucks with aid enter from Egypt through the Rafah crossing, the only entry point into Gaza not controlled by Israel. But aid workers say the convoys meet only a tiny fraction of the territory's mounting humanitarian needs. Before the war, an average of 500 trucks entered Gaza each day.

The U.S. Has been working with other mediators to send in more humanitarian aid, but Israel is demanding strict screening to make sure none falls into the hands of Hamas. The U.S. Says Hamas has meanwhile refused to open the Gaza side of the Rafah crossing to let hundreds of foreign passport holders leave.

<doc-sep>

[DOC_4]
ARNIA: A Border Security Force (BSF) personnel sustained minor injury in an unprovoked firing by Pakistan Rangers in Jammu and Kashmir's Arnia sector, the Border guarding force said in a statement. As per the BSF, the Pakistan Rangers resorted to unprovoked firing in the Arnia area during the intervening night of Thursday and Friday and it was befittingly responded by BSF troops.
""Pak Rangers resorted to Mortar shelling which was countered by BSF with appropriate response. Intermittent firing continued till 3 a.m.,"" said the BSF, which is mandated to guard the 3,323 km India-Pakistan border.
""One BSF personnel sustained minor injuries in Pak firing has been provided with medical aid,"" added the BSF.

Meanwhile, panic gripped Arnia and other areas of the RS Pura sector of Jammu and Kashmir along the India-Pakistan international border after Pakistan Rangers resorted to unprovoked firing on BSF troops.
""There was a lot of firing by Pakistan overnight. No person was injured but houses were damaged. This kind of firing from the Pakistan side has been witnessed after almost six years. Our security forces retaliated to the firing,"" Dev Raj Chowdhary, Sarpanch, at border village Bulleh Chak in Sai Kalan, Arnia of RS Pura sector in Jammu said.


Locals also found mortal shells in the border village of Bulleh Chak.

""We have found three mortar shells so far after overnight shelling from the Pakistan side. No person has been injured in the incident,"" a local said.


Alarmed at the firing, panicked locals stayed indoors. ""A large mortar shell damaged our house around 8 p.m. last night. The kitchen has been damaged. By God's grace, we were saved. The glasses of the windows have broken,"" Ekta who resides in Arnia said.

<doc-sep>

[DOC_5]
El Salvador is charging passengers from Africa or India a $1,000 (over Rs 80,000) fee, in an apparent bid to curb migration to the US through the Central American country.
People traveling on passports from India or any one of more than 50 African nations will be obliged to pay the fee, El Salvador’s port authority said in a statement on its website dated October 20.
The money raised will be used to improve the nation’s main international airport, the authority added.
El Salvador President Nayib Bukele this week met Brian Nichols, US assistant secretary of state for Western Hemisphere affairs, to discuss “efforts to address irregular migration,” among other topics. US Customs and Border Patrol encountered a record 3.2 million migrants across the country in fiscal year 2023, which ended in September.

Many migrants from Africa and elsewhere make it to the US via Central America.


Including VAT, the additional cost is $1,130 from travelers from the affected countries. The new fee took effect October 23 and was imposed due to increased use of the country’s main international airport, according to the statement.

Airlines will be required to notify Salvadoran authorities daily of passengers who come from a list of 57 countries in Africa, and India.


Colombian airline Avianca, which is one of the hub’s biggest users, began notifying travelers that passengers from the list of countries must pay the mandatory fee before boarding flights to El Salvador.","In the Arnia sector of Jammu and Kashmir, a Border Security Force (BSF) personnel sustained minor injuries in unprovoked firing by Pakistan Rangers. The incident occurred during the night, with Pakistan Rangers initiating mortar shelling, met with a befitting response from BSF troops. The exchange of fire persisted until 3 a.m., resulting in one BSF personnel sustaining minor injuries. Panic spread across Arnia and other areas of the RS Pura sector as Pakistan Rangers engaged in unprovoked firing on BSF troops. While no casualties were reported, houses suffered damage, marking a resurgence of such firing after nearly six years. Mortar shells were discovered in the border village of Bulleh Chak, causing concern among locals. The firing prompted residents to stay indoors, with reports of damaged houses and shattered windows.","The Israeli military has carried out a second ground raid into Gaza in as many days and struck targets on the outskirts of Gaza City, the military said Friday, as it prepares for a widely expected ground invasion of the Hamas-ruled territory. The military said the raids enable forces to “uncover the enemy,” to remove explosives and launch pads, and to prepare the ground for the next stages of the war.","The Palestinian death toll has soared past 7,000 as Israel has carried out waves of devastating airstrikes in response to a bloody Hamas incursion into southern Israel on Oct 7.<n>The military said ground forces raided inside Gaza, striking dozens of militant targets over the past 24 hours.<n>The military said aircraft and artillery bombed targets in Shijaiyah, a neighborhood on the outskirts of Gaza City that was the scene of a bloody urban battle in the 2014 Gaza war.","Israeli forces backed by fighter jets and drones carried out a second ground raid into Gaza, striking targets in Shijaiyah, a neighborhood on the outskirts of Gaza City that was the scene of the Oct. 7 massacre, killing more than 1,400 people. Israel has barred all fuel deliveries, saying it believes Hamas would steal them for military purposes. The United States has sent two aircraft carrier strike groups to the region, along with additional fighter jets and other weaponry and personnel, in part to deter Iran and its allies from entering the war on the side of Hamas."
