input_text,reference_summary,bart_summary,pegasus_summary,led_summary
"[DOC_1]
Two Australian universities -- Wollongong and Deakin -- will soon establish campuses in 'GIFT City', Union education minister Dharmendra Pradhan announced on Wednesday.The two varsities will sign an agreement on setting up their campuses during Australian Prime Minister Anthony Albanese's maiden visit to India next week. Pradhan made the announcement during an event at Delhi University's Venkateshwara College that hosted Australian education minister Jason Clare, who is on a four-day visit to the country. ""Two Australian universities will be establishing campuses in the GIFT City in Gujarat. We want to partner with Australia with accessibility, affordability and quality of education for youngsters,"" he said. The two universities are Deakin University and Wollongong University. These are the first two foreign varsities to be setting up their campuses in GIFT (Gujarat International Finance Tec) City. The Australian minister also announced that noted former cricketer Adam Gilchrist, the global brand ambassador of Wollongong University, will help in setting up the university campus in India.Talking about the ties between the two countries, Pradhan said both the countries share some common things.""India and Australia share some common things. Both aspirations are similar though the sizes of both countries are different; the strategy roadmap and aspirations are similar. I observe closely the development of Australia from the last 50 years,"" the minister said.""One of the key strategies of Australia is education knowledge and skill development and vocational training. India, being a young nation, we want to collaborate with Australia,"" the minister added. Deakin University is ranked 266 in QS World University Rankings and is also among the top 50 young varsities. It has four campuses in Australia and many students from India go to study there.Wollongong University is the first foreign university to open a campus in the UAE. When contacted, representatives of the two universities said more details would be available following a formal announcement next week. GIFT City is an emerging global financial and IT services hub, a first-of-its-kind in India, designed to be at or above par with globally benchmarked business districts.PTI

<doc-sep>

[DOC_2]
Two Australian universities will soon set up campuses at Gujarat International Finance Tec-City (GIFT City), Union education minister Dharmendra Pradhan said on Wednesday,adding that the development will add a “glorious chapter” in the bilateral relationship of the two countries.The two varsities – Wollongong University and Deakin University – will sign an agreement in this regard during Australian Prime Minister Anthony Albanese’s maiden visit to India next week, he added.Pradhan was addressing an event at Sri Venkateswara College in the national capital when he made the announcement. He was accompanied by Australian education minister Jason Clare who is on a five-day educational visit to India.“Two Australian universities will be establishing campuses in the GIFT City in Gujarat. We want to partner with Australia with accessibility, affordability and quality of education for youngsters,” Pradhan said.The formalities will be completed on the sidelines of the Australian Prime Minister’s visit to India next week, he added.GIFT City is an emerging global financial and IT services hub, a first-of-its-kind in India, designed to be on or above par with globally benchmarked business districts.At least 25 prestigious Indian universities have some kind of engagement with their counterparts in Australia, Pradhan said, adding, “next week, another glorious chapter will be added to our journey as two prestigious Australian universities are coming to India.”“Australia will be an important partner of India during its journey of becoming a developed country by 2047,” the minister said.Clare, who also addressed the gathering, said former cricketer Adam Gilchrist, the global brand ambassador of Wollongong University, will help in setting up the varsity campus in India.He said that Australia and India on Thursday will sign an agreement to come up with a mechanism for mutual recognition of qualifications that will allow students to access education in both countries.“It means that an Indian student can be sure that the degree that they obtain from an Australian university will be recognised if they want to continue further education here in India…,” Clare said.“This is just the start. It is part of a two-step process. First, there is a mechanism to recognise qualification degrees. The second is to work together with professions on mutual recognition agreements so that Australian and Indian graduates will be able to practice professionally in either country…” he added.The Australian minister also said that 10 new Memorandums of Understanding (MoUs) will be signed for educational tie-ups next week.Later in the day, the two ministers visited and interacted with students at Kendriya Vidyalaya No-2 in Delhi Cantonment.

<doc-sep>

[DOC_3]
Bill Gates finds India has made rapid strides in improving health equality, with scope for data and AI to close the gap further. Machine learning (ML) can assist in analysing diverse datasets to improve predictive healthcare but has not delivered on the promise that has driven up valuations of health technology companies. Social determinants of health outcomes continue to evade technology-assisted solutions. Greater diversity of approach, improved reporting requirements and customising the user  ..","Australian universities Wollongong University and Deakin University will establish campuses at Gujarat International Finance Tec-City (GIFT City), marking a significant step in the bilateral relationship between the two countries. The universities aim to partner with Australia in terms of accessibility, affordability, and quality of education for youngsters. The formalities will be completed during Australian Prime Minister Anthony Albanese's maiden visit to India next week. GIFT City is an emerging global financial and IT services hub, designed to be on or above par with globally benchmarked business districts. Australia will be an important partner of India's journey towards becoming a developed country by 2047. The two countries will also sign an agreement to create a mechanism for mutual recognition of qualifications, allowing students to access education in both countries.","The two universities will soon establish campuses in Gujarat International Finance Tec-City (GIFT City), a first-of-its-kind in India, designed to be on or above par with globally benchmarked business districts.The two varsities will sign an agreement on setting up their campuses during Australian Prime Minister Anthony Albanese's maiden visit to India next week. Pradhan made the announcement during an event at Delhi University's Venkateshwara College that hosted Australian education minister Jason Clare, who is on a four-day visit to the country. ""Two Australian universities will be establishing campuses in the GIFT City","Two Australian universities -- Wollongong and Deakin -- will soon establish campuses in 'GIFT City', Union education minister Dharmendra Pradhan announced on Wednesday.The two varsities will sign an agreement on setting up their campuses during Australian Prime Minister Anthony Albanese's maiden visit to India next week. Pradhan made the announcement during an event at Delhi University's Venkateshwara College that hosted Australian education minister Jason Clare, who is on a four-day visit to the country. The two universities are Deakin University and Wollongong University. These are the first two foreign varsities to be setting up their campuses in GIFT (Gujarat","The two varsities will soon establish campuses in Gujarat International Finance Tec-City (GIFT City), a first-of-its-kind in India, designed to be on or above par with globally benchmarked business districts.The two varsities will sign an agreement on setting up their campuses during Australian Prime Minister Anthony Albanese's maiden visit to India next week. Pradhan made the announcement during an event at Delhi University's Venkateshwara College that hosted Australian education minister Jason Clare, who is on a four-day visit to the country. ""Two Australian universities will be establishing campuses in the GIFT"
"[DOC_1]
The BJP is looking for a home run no doubt but its latest momentum on the Ram temple at Ayodhya or its craftsmanship of a people-friendly budget, howsoever temporary, indicate the burden that none of the Opposition parties has to carry, that of holding out its report card. In short, how much of an achche din was it able to usher, rather how many achche dins in the five-year tenure? So its exam rush hyperactivity is understandable in making up for a paltry performance in comparison to the decisive verdict of 2014, one that no ruling party enjoyed over the last decade. By that measure, that chasm is wide indeed.

The Ram Mandir is an emotionally galvanising force that had got the Sangh Parivar close to claiming political power through the BJP. But governance demanded pragmatism and through the Vajpayee and Modi years, Ayodhya has at best been cannon fodder for rhetoric and a subject of ideological reverence given the legal complexities concerned. And fringe issues like gauraksha or polarisation have been more of an embarrassment and headache than serving the Hindu cause over the last few years. But now that the party’s development agenda doesn’t look shiny enough, post the electoral debacle in the heartland States, and it needs to re-energise its cadres relying on the RSS grassroots network, it has to be seen as being purposeful about the temple. This has become necessary after the downbeat mood of workers at the last parliamentary party meeting hit home. Besides, RSS chief Mohan Bhagwat and even old ally Shiv Sena have launched a pincer attack on the unfulfilled promise of a Ram temple, saying that would, if not anything, address the BJP’s reason for being. Even the BJP’s latest plea of returning the superfluous land outside the disputed site in Ayodhya to owners is fraught with legal interjections, some claiming that the fate of that too is linked to a decision on the title suit. But the party brass is hoping it will at least be seen as attempting a closure within legal perimeters, even if not entirely successful. Politically, it would allow it to neutralise a resurgent Congress, which is itself pursuing soft Hindutva. In fact, the Congress is on the backfoot on Ayodhya and has refused TV debates on the subject.

However, Modi’s bigger concern is the electorate which feels betrayed and comprises the poor, both rural and urban, and the middle classes. The temple, as ground surveys indicate, is hardly expected to wash off on an aspirational society, more interested in livelihood indices than identity. And with Congress chief Rahul Gandhi having already floated the idea of a universal basic income, the BJP has to be seen as a healer given the crippling intensity of farm distress and the cascading effects of demonestisation. There is talk of the interim Budget promising direct money transfers to farmers’ accounts, waiving off interest on crop loans for farmers who pay on time, revising tax slabs and even announcing relief for petroleum companies to arrest fuel prices. Of course, nobody is asking where the money will come from. But will last-minute affirmative action and a veiled election manifesto work for the BJP government? The Indian voter has become much too aware to be enchanted by the gimmickry of grants and sops. It was precisely because they were tired of these populist fruits dangled by previous regimes that they gave a monolithic verdict hoping that the Modi government would have the mandate to take decisive steps. Alas, those came few and far between adventurist moves and the report card, in the end, has a repetitive feel about it. Faith takes time to build, just a moment to destroy. Modi was seen as a tall leader, still is. Hence the expectation of him to be less formulaic and not resort to cliches. Particularly of the 11th hour kind.

<doc-sep>

[DOC_2]
The most significant thing about India’s rise — by three ranks — to the 78th position in Transparency International’s corruption perceptions index is the fact that the country has jumped past its bigger Eastern neighbour, China. In fact, the Middle Kingdom has dropped dramatically in the corruption rankings. Predictably, the communist media will dismiss the report but the fact is that under President Xi Jinping, who made fighting corruption a supposed cornerstone of his administration, the unscrupulous boomed thanks to projects like the Belt and Road Initiative. Corruption in China was just a stick used by Xi to eliminate his political rivals. However, India’s slight rise overtaking China is also a sign that under the Narendra Modi dispensation, there has been a palpable sense that large-scale political corruption reduced. This is not to say that every estate of the Indian state, including the fourth estate, the media, is riddled with scams. But as they say, we must take baby steps to start with.

India’s problem is not just of corruption across the executive but that the malaise has taken root in society much like an invasive plant species and it is extremely difficult to remove it. The current state of Indian banks because of their profligate lending habits was in no small part due to questionable understanding between parties. Besides one has to understand that corruption is not always a case of money changing hands, it is also that network of favours. A job for a relative, school admission for a child, the worst forms of a corrupt system rarely involve money. Removing that will take years of work and a mindset change that everything, from chai-pani as the telephone lineman once asked for just to do his job to the payoffs for contracts, is wrong and that means teaching children at a very young age that corruption is bad. But in a country with an economic disparity as wide as that in India, eliminating corruption is almost impossible. That does not mean that we should not do our utmost to try and reduce it. There is little authentic economic data to prove this but rough calculations made by anti-corruption watchdogs show that we lose a percentage point or more of growth every year thanks to graft cases. Because it almost always benefits a few at the cost of the many. The poor municipal roads and potholes courtesy the a contractor ‘mafia’ in many cities are evidence of this. So yes, while we should be pleased with our rise and have a bit of schadenfreude about China's decline, we should not lose sight of the fact that the road ahead to reducing corruption is a long and a hard one.

<doc-sep>

[DOC_3]
While travelling across central India, especially through the Western Ghats, one will not fail to observe the clear-cut changes made to the topography of the region. The lush, green forests and the tree canopy have all steadily declined in the last few years. Vegetation has given way to more dusty, dry-looking land that seems to exist throughout the year. The meandering forest streams that once used to punctuate the verdant forests have all dried up along with the forest cover. As the Indian hinterland shows some changes that are in tune with worsening climate change, the world itself is realising that a much larger problem — thanks to rapid climate change — is knocking on the door, which is the issue of rapid desertification.

As greening and afforestation measures have proved to be an uphill task, desertification is fast making an already difficult battle even tougher. This aspect was very much evident during the recent 17th Session of the Committee for the Review of the Implementation (CRIC17) of the United Nation’s Convention to Combat Desertification (UNCCD) in Guyana. The gathering understood the need for emergency steps to stop desertification that now grips almost all countries around the world.

The preliminary assessment report circulated by the Secretariat of the UNCCD found that in the first 15 years of the millennium, 20 per cent of the world’s productive and healthy land was degraded. This seemingly low-level threat has now cornered 169 countries in its grip, leading to rapid land degradation and impacting nearly 3.2 billion people economically. The assessment was made on the basis of data submitted by 135 countries. In October, 2015, after the world adopted the Sustainable Development Goals (SDGs), the 12th Conference of parties to UNCCD endorsed the SDG target 15.3. Under this target lies a new concept called land degradation neutrality, according to which, countries are attempting to halt land degradation through desertification.

One of the crucial aspects to containing desertification is to understand the speed and area of concentration of the deserted land and the factors that trigger the same. Moreover, besides adversely impacting the people economically, degraded lands and soils pose a severe threat to the provision of ecosystem services and economic development globally. Given the gravity of the problem, in the last four years alone, 82 countries, including India, have committed to stop land degradation by 2030. But without an adequate plan for land governance, education, demography and land use planning, this ambitious target seems difficult to be achieved.

In order to attain meaningful progress in controlling desertification, instead of treating the symptoms of land degradation, India must focus on the causes. The immediate cause that typically triggers desertification is the loss of primary vegetation. Most lands fall prey to mining and other unnatural activities which result in the removal of vegetation due to human activities.

Sustained lack of green cover causes a dry land to develop an arid nature and eventually results in what can be termed as the “death of the topsoil.” This renders re-growth of any greenery almost impossible and leaves the land degraded.

Then there are also other factors that drive the disappearance of the green cover such as drought, climatic shifts, tillage for agriculture, overgrazing and deforestation for fuel or construction materials. Vegetation plays a major role in determining the biological composition of the soil.

Studies have shown that in many environments, the rate of erosion and run-off decreases exponentially with increased vegetation cover. Unprotected, dry soil surfaces blow away with the wind or are washed off by flash floods, thereby leaving infertile lower soil layers that bake in the sun and become unproductive hardpan, which is an apt environment for desertification.

In fact, according to many scientists, one of the most common causes for desertification is overgrazing or excessive consumption of vegetation by the cattle. The scientific community also concurs with this contention. Interestingly, facts show that there is a natural cause for the existence of desert in the place, which is now the Sahara desert. A natural climate cycle that caused a lack of water in this area from time to time, coupled with overgrazing by the local population, slowly converted the Sahara savanna to the Sahara desert. Precipitation factors were aided by climate change that also caused the acceleration and led to the formation of deserts.

India must recognise the patterns and perceive the threats that dry lands in various parts of the country face. Due to the lack of natural water sources, or drying up of the same, coupled with the problem of overgrazing, Indian lands are faced with the danger of becoming degraded and may eventually be deserted.

The first step to prevent the same will be to ensure that satellite data is employed to create a detailed database that categorises the lands and identifies those that are on the edge of becoming deserts. Emergency measures of replenishing the groundwater table, stopping anthropogenic activities and refreshing the green cover can be immediate solutions. Land is precious and in short supply thanks to population explosion. To lose the little land to deserts would be a true misfortune for India.

<doc-sep>

[DOC_4]
The Aam Aadmi Party (AAP) Government on Tuesday decided to convene a seven-day Budget Session of the Delhi Assembly starting February 22.

According to an official statement, the decision was taken at a Cabinet meeting chaired by Chief Minister Arvind Kejriwal. “The Cabinet in its meeting on Tuesday, chaired by Chief Minister Arvind Kejriwal, recommended convening of the eighth session (Budget Session) of the sixth Delhi Legislative Assembly from February 22-28, 2019,” the Government said in the statement.

Last year, the Aam Aadmi Party government had presented a Rs 53,000 crore budget for 2018-19 in the Assembly, which laid emphasis on environment, health, education a","The BJP, facing dissatisfaction over its governance and a need to energize its base, rekindles focus on the Ram temple issue after electoral setbacks. While emotionally significant, the temple remains a recurring topic rather than a solved matter. The party seeks closure through returning land but faces legal complexities. Aiming to counter a resurgent Congress and heal voter disillusionment, it plans last-minute actions like direct money transfers. However, such measures might not sway an electorate focused on livelihood over identity politics. Modi’s leadership, expected less formulaic, faces scrutiny for lacking decisive steps amidst repeated populist gestures. Voter disillusionment challenges the party's reliance on last-minute maneuvers.




","The BJP is looking for a home run no doubt but its latest momentum on the Ram temple at Ayodhya or its craftsmanship of a people-friendly budget, howsoever temporary, indicate the burden that none of the Opposition parties has to carry, that of holding out its report card. In short, how much of an achche din was it able to usher, rather how many achte dins in the five-year tenure? So its exam rush hyperactivity is understandable in making up for a paltry performance in comparison to the decisive verdict of 2014, one that no ruling party enjoyed over the last","The Ram Mandir is an emotionally galvanising force that had got the Sangh Parivar close to claiming political power through the BJP. But governance demanded pragmatism and through three years, Ayodhya has at best been cannon fodder for rhetoric and a subject of ideological reverence given the legal complexities concerned. But now that the party’s development agenda doesn’t look shiny enough, post the electoral debacle in the heartland States, and it needs to re-energise its cadres relying on the RSS grassroots network, it has to be seen as being purposeful about the temple. This has become necessary after the downbeat mood of workers at the last","The BJP is looking for a home run no doubt but its latest momentum on the Ram temple at Ayodhya or its craftsmanship of a people-friendly budget, howsoever temporary, indicate the burden that none of the Opposition parties has to carry, that of holding out its report card. Besides one has to understand that corruption is not always a case of money changing hands, it is also that network of favours. A job for a relative, school admission for a child, the worst forms of a corrupt system rarely involve money. Removing that will take years of work and a mindset change that everything, from chai-"
