input_text,reference_summary,bart_summary,pegasus_summary,led_summary
"[DOC_1]
Defence Minister Rajnath Singh on Wednesday said that the Chinese People's Liberation Army's (PLA) violent conduct completely violates all norms and agreements between India and China.

""The PLA's violent conduct completely violates all norms and agreements between India and China. India has taken strong measures to safeguard its borders. We are committed to resolving the issue peacefully,"" Singh said in a statement.

Singh's statement comes after a violent clash between Indian and Chinese troops in Galwan Valley, Ladakh, on June 15, 2020, in which 20 Indian soldiers were killed. The PLA also suffered casualties, but the exact number is unknown.

The clash was the deadliest between Indian and Chinese troops since 1975. It has led to a significant increase in tensions between the two countries.

Singh said that India has taken strong measures to safeguard its borders. He said that the Indian Army is fully prepared to deal with any challenge from the PLA.

""Our armed forces are fully prepared to deal with any challenge. We are committed to resolving the issue peacefully. However, we will not compromise on our national security,"" Singh said.

The Indian government has said that it is committed to resolving the issue with China through dialogue and diplomacy. However, it has also said that it will not be intimidated by the PLA's aggressive behavior.

The clash in Galwan Valley has raised concerns about the possibility of a war between India and China. However, both countries have said that they do not want war.

<doc-sep>

[DOC_2]
Defence Minister Rajnath Singh on Wednesday said that the Chinese People's Liberation Army's (PLA) violent conduct completely violates all norms and agreements between India and China.

""The PLA's violent conduct completely violates all norms and agreements between India and China. India has taken strong measures to safeguard its borders. We are committed to resolving the issue peacefully,"" Singh said in a statement.

Singh's statement comes after a violent clash between Indian and Chinese troops in Galwan Valley, Ladakh, on June 15, 2020, in which 20 Indian soldiers were killed. The PLA also suffered casualties, but the exact number is unknown.

The clash was the deadliest between Indian and Chinese troops since 1975. It has led to a significant increase in tensions between the two countries.

Singh said that India has taken strong measures to safeguard its borders. He said that the Indian Army is fully prepared to deal with any challenge from the PLA.

""Our armed forces are fully prepared to deal with any challenge. We are committed to resolving the issue peacefully. However, we will not compromise on our national security,"" Singh said.

The Indian government has said that it is committed to resolving the issue with China through dialogue and diplomacy. However, it has also said that it will not be intimidated by the PLA's aggressive behavior.

The clash in Galwan Valley has raised concerns about the possibility of a war between India and China. However, both countries have said that they do not want war.

<doc-sep>

[DOC_3]
Defence Minister Rajnath Singh on Wednesday said that the Chinese People's Liberation Army's (PLA) violent conduct completely violates all norms and agreements between India and China.

""The PLA's violent conduct completely violates all norms and agreements between India and China. India has taken strong measures to safeguard its borders. We are committed to resolving the issue peacefully,"" Singh said in a statement.

Singh's statement comes after a violent clash between Indian and Chinese troops in Galwan Valley, Ladakh, on June 15, 2020, in which 20 Indian soldiers were killed. The PLA also suffered casualties, but the exact number is unknown.

The clash was the deadliest between Indian and Chinese troops since 1975. It has led to a significant increase in tensions between the two countries.

Singh said that India has taken strong measures to safeguard its borders. He said that the Indian Army is fully prepared to deal with any challenge from the PLA.

""Our armed forces are fully prepared to deal with any challenge. We are committed to resolving the issue peacefully. However, we will not compromise on our national security,"" Singh said.

The Indian government has said that it is committed to resolving the issue with China through dialogue and diplomacy. However, it has also said that it will not be intimidated by the PLA's aggressive behavior.

The clash in Galwan Valley has raised concerns about the possibility of a war between India and China. However, both countries have said that they do not want war."," Defence Minister Rajnath Singh said that the Chinese People's Liberation Army's (PLA) violent conduct in Galwan Valley, Ladakh, on June 15, 2020, completely violates all norms and agreements between India and China.

Singh said that India has taken strong measures to safeguard its borders and that the Indian Army is fully prepared to deal with any challenge from the PLA. He said that India is committed to resolving the issue peacefully, but will not compromise on its national security.
","Defence Minister Rajnath Singh on Wednesday said that the Chinese People's Liberation Army's (PLA) violent conduct completely violates all norms and agreements between India and China. India has taken strong measures to safeguard its borders. However, the exact number is unknown.","The clash in Galwan Valley has raised concerns about the possibility of a war between India and China. However, both countries have said that they do not want war. However, both countries have said that they do not want war.","Defence Minister Rajnath Singh on Wednesday said that the Chinese People's Liberation Army's (PLA) violent conduct completely violates all norms and agreements between India and China. India has taken strong measures to safeguard its borders. India has taken strong measures to safeguard its borders. However, both countries have said that they do not want war."
"[DOC_1]
The Guwahati Municipal Corporation (GMC) has launched a ""construction and demolition waste"" pick-up service to prevent the debris from clogging drains and waterways in the city. Sharing insights into the initiative, GMC Assistant Commissioner Suhel Yasir explained that the corporation is taking proactive measures to clear the dust and debris resulting from demolition activities.He further noted that while the GMC currently lacks a dedicated processing facility for such waste, they are actively considering the establishment of a C&D facility which is mandated under the Swachh Bharat Mission to make the city waste-free. The GMC has also introduced a helpline number which allows the public to request waste removal services from the corporation following demolition projects. The specific fee for this service is yet to be determined and will be fixed at a later date.

<doc-sep>

[DOC_2]
Delhi's air quality was recorded in the 'poor' category for the fourth consecutive day on Thursday and any improvement is unlikely soon, according to monitoring agencies.

The city's 24-hour average Air Quality Index (AQI) stood at 256 at 4 pm, worsening from 243 on Wednesday and 220 on Tuesday.

The average AQI was 235 in neighbouring Ghaziabad, 254 in Faridabad, 230 in Gurugram, 191 in Noida and 260 in Greater Noida.

According to the Centre's Air Quality Early Warning System for Delhi, the city's air quality is likely to oscillate between the 'poor' and 'very poor' categories over the next three to four days.

An AQI between zero and 50 is considered 'good', 51 and 100 'satisfactory', 101 and 200 'moderate', 201 and 300 'poor', 301 and 400 'very poor', and 401 and 500 'severe'.

The government also launched a campaign to curb vehicular pollution on Thursday, a year after Lieutenant Governor V K Saxena put it on hold, questioning its effectiveness.

A 2019 study conducted by the Central Road Research Institute showed that keeping engines running at traffic signals can increase pollution levels by more than 9 per cent.

A range of emission inventory and source apportionment studies carried out for Delhi in the past few years suggested that on-road vehicular exhaust emissions account for 9 per cent to 38 per cent of PM2.5 emissions in the capital.

Delhi's air quality had turned 'very poor' on Sunday for the first time since May, mainly due to a drop in temperature and wind speed, which allowed pollutants to accumulate.

Unfavourable meteorological conditions and a cocktail of emissions from firecrackers and paddy straw burning, in addition to local sources of pollution, push Delhi-NCR's air quality to hazardous levels around Diwali every year.

According to an analysis conducted by the Delhi Pollution Control Committee, the capital experiences peak pollution from November 1 to November 15, when stubble burning incidents in Punjab and Haryana peak.

Delhi Environment Minister Gopal Rai said the government has identified eight more pollution hotspots in addition to the existing 13 in the national capital, and special teams will be deployed there to check pollution sources.

Rai said the government has also decided to use suppressant powder to prevent dust pollution in the city.

Dust suppressants could include chemical agents like calcium chloride, magnesium chloride, lignosulfonates and various polymers. These chemicals work by attracting and binding fine dust particles together, making them too heavy to become airborne.

The Commission for Air Quality Management (CAQM), a statutory body responsible for proactively implementing the pollution control plan known as the Graded Response Action Plan (GRAP), had on Saturday directed authorities in the NCR to increase parking fees to discourage private transport and enhance the services of CNG or electric buses and metro trains amid a likely increase in pollution levels.

This action is part of Stage II of GRAP which is implemented when Delhi's AQI is predicted to turn 'very poor'.

GRAP categorises actions into four stages: Stage I 'poor' (AQI 201-300); Stage II 'very poor' (AQI 301-400); Stage III 'severe' (AQI 401-450); and Stage IV 'severe plus' (AQI >450).

The Delhi government had last month launched a 15-point action plan to mitigate air pollution in the capital during the winter season, with a strong emphasis on addressing dust pollution, vehicular emissions and open burning of garbage.

<doc-sep>

[DOC_3]
Thousands of people watched the famous Ravan Dahan event at Central Sports Grounds in Banaras Locomotive Works (BLW) on Tuesday evening as this year the Dussehra festival was celebrated with great pomp and its traditional fervour. In the recent decades, the event has become very popular as a huge number of people turned out there. When the effigies of ‘Demon King’ Ravana, his brother Kumbhakaran and son Meghnad which were 75, 70 and 65 feet high respectively were burnt, the mood of the people turned electrified and the slogans of ‘Jai Siya Ram’ echoed the atmosphere. The grounds as well as roads in its surrounding areas were packed with thousands of people. A large number of firecrackers were set in all the three effigies.

The event marked the triumph of good over evil and prior to that, the artistes performed Ramlila. The audience was mesmerised by the dialogue of Angad and Ravana and wars between Lord Ram and Ravana as well as Lakshman and Meghnath. After defeating Ravana by Lord Ram, the event of burning of effigies began. Prior to effigy burning, the firecrackers were lit, changing the mood of the people. Earlier, the Principal Chief Electrical Engineer (PCEE) SK Srivastava performed the aarti of Lord Ram and Mata Sita. Then the artistes performed Lila of Ram Van Gaman to Ravana Vadh based on Ramcharitmanas. The Lila performed by the students of BLW Inter College for two-and-a-half hours was highly appreciated.

There was a ban on carrying bags, tiffins, water bottles and any kind of inflammable material in the fair premises. Even after 12 noon, all types of vehicles including two wheelers were stopped from entering the Mela areas. General Manager Basudev Panda constantly instructed the officials to make the Vijayadashami fair well organised. District administration, Uttar Pradesh Police, Railway Protection Force, St John’s Ambulance Brigade, Civil Defence, District Scouts and Guides and members of Vijayadashami Committee played an important role in conducting the fair smoothly and peacefully. To deal with any untoward incident, the medical team of BLW Central Hospital was present there, setting up its first aid posts there.

   The Ravana Dahan event of BLW is unique in itself as it is an example of Ganga-Yamuni (harmonious) culture. The effigies of Ravana, Kumbhakaran and Meghnad are made by Shamshad Khan and his family, who have been residents of Kashi for three generations and Angad was portrayed by Sohrab Hussain in this unique Ramlila.

The function was also attended by Principal Chief Engineer Vinod Bampal, Principal Chief Personnel Officer Ranvijay, Chief Mechanical Engineer (SE) Neeraj Jain, Chief Materials Manager (Loco) Trilok Kothari, Chief Materials Manager (Headquarters) SK Mishra, Senior Deputy General Manager Vijay, Chief Engineer Vinod Kumar Shukla, Chief Electrical Engineer (Inspection) MK Singh, Chief Mechanical Engineer (QMS) Ramjanam Choubey, Public Relations Officer Rajesh Kumar and a large number of BLW officers and employees. In making the programme successful, Vijayadashami Samiti’s office-bearers Anup Singh, Alok Singh, Mohammad Eklakh Hussain, VD Dubey, Dharmendra Singh, Ritesh Singh, Tarkeshwar Singh, Sunil Kumar, Chandramohan Jha, Sanad Pandey and Bobby Singh played an important role. In the end, the vote of thanks was given by the convener of Vijayadashami Samiti MP Singh, Deputy Chief Mechanical Engineer (Spare).","The famous Ravan Dahan event at Central Sports Grounds in Banaras Locomotive Works (BLW) marked a grand celebration of Dussehra, drawing thousands of spectators. The effigies of Ravana, Kumbhakaran, and Meghnad, ranging from 65 to 75 feet high, were burnt, creating an electrifying atmosphere with chants of ""Jai Siya Ram."" Prior to the effigy burning, Ramlila performances captivated the audience, with dialogues between Angad and Ravana and battles involving Lord Ram and Lakshman. The event symbolized the triumph of good over evil and showcased a unique Ganga-Yamuni culture. Strict security measures were in place, and various officials and volunteers contributed to its success.","The Guwahati Municipal Corporation (GMC) has launched a ""construction and demolition waste"" pick-up service to prevent the debris from clogging drains and waterways in the city. Sharing insights into the initiative, GMC Assistant Commissioner Suhel Yasir explained that the corporation is taking proactive measures to clear the dust and debris resulting from demolition activities.He further noted that while the GMC currently lacks a dedicated processing facility for such waste, they are actively considering the establishment of a C&D facility which is mandated under the Swachh Bharat Mission to make the city waste-free. The GMC has","The Guwahati Municipal Corporation (GMC) has launched a ""construction and demolition waste"" pick-up service to prevent the debris from clogging drains and waterways in the city. The specific fee for this service is yet to be determined and will be fixed at a later date. The GMC has also introduced a helpline number which allows the public to request waste removal services from the corporation following demolition projects. The specific fee for this service is yet to be determined and will be fixed at a later date.","The Guwahati Municipal Corporation (GMC) launched a ""construction and demolition waste"" pick-up service to prevent the debris from clogging drains and waterways in the city. Sharing insights into the initiative, GMC Assistant Commissioner Suhel Yasir explained that the corporation is taking proactive measures to clear the dust and debris resulting from demolition activities. He further noted that while the GMC currently lacks a dedicated processing facility for such waste, they are actively considering the establishment of a C&D facility which is mandated under the Swachh Bharat Mission to make the city waste-free. The GMC has also introduced"
